{
  "executionId": "50000000-0000-4000-8000-000000000001",
  "sourceId": "11111111-1111-4111-8111-111111111111",
  "sourceVersion": "sha256:68fc3e599c5dcb5523a2d65c2d9586bfbec34d8b0dae0660659cf8b965533b13",
  "connectorId": "connectors/tabular-reader-v1",
  "connectorVersion": "1.0.0",
  "connectorCapabilityHash": "ccca6841c2a5d15058240039228b22351d60e6279bdcef5f1b78f687b7114ade",
  "authorizationScopeId": "authorized-assets",
  "policyHash": "bbbbbbbbbbbbbbbbbbbbbbbbbbbbbbbbbbbbbbbbbbbbbbbbbbbbbbbbbbbbbbbb",
  "revocationEpoch": 0,
  "inputEvidenceIds": [
    "22222222-2222-4222-8222-222222222222",
    "66666666-6666-4666-8666-666666666666",
    "77777777-7777-4777-8777-777777777777",
    "88888888-8888-4888-8888-888888888888",
    "99999999-9999-4999-8999-999999999999",
    "aaaaaaaa-aaaa-4aaa-8aaa-aaaaaaaaaaaa",
    "12121212-1212-4212-8212-121212121212",
    "13131313-1313-4313-8313-131313131313"
  ],
  "evidenceSetHash": "ec2b9ae498b6560a4a9cf813572340b72c71d37cc3623bf9070d3c7210e0981b",
  "providerId": "registered-semantic-provider",
  "modelId": "semantic-model",
  "modelVersion": "1.0.0",
  "modelDeploymentHash": "1111111111111111111111111111111111111111111111111111111111111111",
  "admission": {
    "decision": "allowed",
    "modelPolicyHash": "2222222222222222222222222222222222222222222222222222222222222222",
    "deploymentRegistrationId": "50000000-0000-4000-8000-000000000002",
    "admittedProviderId": "registered-semantic-provider",
    "admittedModelId": "semantic-model",
    "admittedModelVersion": "1.0.0",
    "admittedModelDeploymentHash": "1111111111111111111111111111111111111111111111111111111111111111",
    "deploymentRegion": "source-compatible-region",
    "sourceResidencyClass": "restricted-region-set",
    "inputClassification": "restricted",
    "providerRetention": "none",
    "trainingUse": false,
    "abuseMonitoringContract": "zero-content-retention-monitoring-v1",
    "decidedAt": "2026-01-01T00:05:00Z"
  },
  "promptId": "semantic-asset",
  "promptVersion": "1.0.0",
  "inputContractRef": "prompt-contracts.schema.json#/$defs/semanticAssetEvidencePack",
  "outputContractRef": "prompt-contracts.schema.json#/$defs/semanticAssetHypothesis",
  "parameterHash": "54c2dfc3131cb8473557fb75c57bbc34114075ede2427b077d5f1c82f22ecb05",
  "redactedInputSha256": "b5f06520034506e4492dcd99c4ebcc7fb67e38e6c965b9830051337e736cd0b6",
  "cache": {
    "decision": "write",
    "keySha256": "6ca0833426e05823501ce3be137e1571f345578f68ca77def33c1b9a4a0de38e",
    "namespace": "f9e29878557a2e3182b2f6d0ef0c0392adf8143c681c35f374502d18badc91d7",
    "entryVersion": "1.0.0",
    "expiresAt": "2026-01-02T00:00:00Z",
    "revocationEpoch": 0,
    "invalidationReason": null,
    "cachedExecutionId": null,
    "admissionPolicyHash": "2222222222222222222222222222222222222222222222222222222222222222",
    "admissionDeploymentRegistrationId": "50000000-0000-4000-8000-000000000002"
  },
  "outcome": "succeeded",
  "startedAt": "2026-01-01T00:05:00Z",
  "completedAt": "2026-01-01T00:05:02Z",
  "usage": {
    "inputUnits": 1000,
    "outputUnits": 200,
    "latencyMs": 2000,
    "estimatedCost": 0.01
  },
  "outputSha256": "6666666666666666666666666666666666666666666666666666666666666666",
  "failureCode": null,
  "retryOfExecutionId": null,
  "promptRef": "package://prompts/semantic-asset.prompt.md",
  "promptSha256": "a4e121295a54faa7c13b9282bc8df5b6c20c54716cfbbb158cb7100777030246",
  "parameterSetRef": "package://examples/model-parameters.json",
  "redactedInputRef": "package://examples/model-redacted-input.json"
}
